{
  "release": "v10",
  "report_title": "DS41RT v10 compact EXL3 TP3 1x / 3-Spark: performance and qualification",
  "report_status": "MEASURED \u2014 PASS; 0 retained non-capacity failure(s), 0 capacity-gated failure(s); no release-readiness claim beyond the recorded evidence",
  "checkpoint": {
    "model_id": "wrldsuksgo2mars/DeepSeek-V4.1-EXL3-K3.25-v1",
    "revision": "cfd4ca1d1934a8e81dd2d7515598d4ce288e8b88",
    "quant": "exl3",
    "family": "k34",
    "bits": [
      3,
      4
    ]
  },
  "images": {
    "coordinator": {
      "tag": "ghcr.io/tpurtell/ds41rt-coordinator:v10",
      "digest": "sha256:2236d94317eb393cd78940efb117bcca14ae06e6d1113c6aeb188b0b22424689",
      "revision": "3dd9a4ac2be9fd17ecf4cb8b7746efdc900d38f0"
    },
    "spark_expert": {
      "tag": "ghcr.io/tpurtell/ds41rt-spark-expert:v10",
      "digest": "sha256:d1b668cd7e87079b5b57e381bdd45dfb4858646533611f18f22061f58ae18dec",
      "revision": "3dd9a4ac2be9fd17ecf4cb8b7746efdc900d38f0"
    },
    "exl3_family_manifest": "/opt/ds41rt/lib/exl3/exl3-k34/manifest.json"
  },
  "network": null,
  "thresholds": null,
  "accounting": {
    "repeats": 3,
    "prefill_warmups": 1,
    "tool_eval_runs": 3,
    "note": "warmup then three matched runs per cell; expectation re-derived in expected-counts.json"
  },
  "arms": [
    {
      "id": "v10-exl3-compact-tp3",
      "quant": "exl3",
      "topology": "TP3",
      "topology_form": "implicit",
      "rtx": 1,
      "sparks": 3,
      "config_path": "/home/tj/Developer/ds41rt/examples/configs/exl3-compact-tp3.config",
      "config_sha256": "087e3498307bffbe97dcb0e333240884f5fddbe3563adb0d492e6d54908984cf",
      "comparison_group": null,
      "images": null,
      "resident_bytes_per_rank": null,
      "remote_layers": null,
      "worker_allocated_layers": null,
      "weight_note": "derived from the daemon placement/residency log; null when not observable",
      "ceiling": {
        "memory_reservation": "32GiB",
        "memory_reservation_bytes": 34359738368,
        "kv_pool_size": "2GiB",
        "kv_pool_size_bytes": 2147483648,
        "prefill_batch_tokens": 256,
        "evidence": "fit-residency.log (reservation_bytes=34359738368, global_bytes=2147164160, device_budget_bytes=34359738368); prefill_batch_tokens declared by examples/configs/exl3-compact-tp3.config",
        "note": null
      },
      "cost_policy": null,
      "runtime_flags": {
        "rtx_layout": "1 GPU(s), host indices 0 (GPU-fe5b6dd0-a77c-c8fb-6360-e1b9d9918ac0)",
        "spark_ranks": null,
        "spark_first_layer": null,
        "memory_reservation": null,
        "prefill_batch_tokens": null,
        "expert_capacity": null,
        "release_identity": null,
        "spark_exl3_package": null,
        "dspark": "on for the main battery; off for the target-only relaunch",
        "prefill_measurement": "30 isolated base x suffix process invocations",
        "prefill_isolated_invocations": [
          "/home/tj/Developer/ds41rt/runs/v10-exl3-tp3/evidence/20260921T1400Z-raptor/raw/prefill-0-1024.json",
          "/home/tj/Developer/ds41rt/runs/v10-exl3-tp3/evidence/20260921T1400Z-raptor/raw/prefill-0-16384.json",
          "/home/tj/Developer/ds41rt/runs/v10-exl3-tp3/evidence/20260921T1400Z-raptor/raw/prefill-0-2048.json",
          "/home/tj/Developer/ds41rt/runs/v10-exl3-tp3/evidence/20260921T1400Z-raptor/raw/prefill-0-32768.json",
          "/home/tj/Developer/ds41rt/runs/v10-exl3-tp3/evidence/20260921T1400Z-raptor/raw/prefill-0-4096.json",
          "/home/tj/Developer/ds41rt/runs/v10-exl3-tp3/evidence/20260921T1400Z-raptor/raw/prefill-0-8192.json",
          "/home/tj/Developer/ds41rt/runs/v10-exl3-tp3/evidence/20260921T1400Z-raptor/raw/prefill-131072-1024.json",
          "/home/tj/Developer/ds41rt/runs/v10-exl3-tp3/evidence/20260921T1400Z-raptor/raw/prefill-131072-16384.json",
          "/home/tj/Developer/ds41rt/runs/v10-exl3-tp3/evidence/20260921T1400Z-raptor/raw/prefill-131072-2048.json",
          "/home/tj/Developer/ds41rt/runs/v10-exl3-tp3/evidence/20260921T1400Z-raptor/raw/prefill-131072-32768.json",
          "/home/tj/Developer/ds41rt/runs/v10-exl3-tp3/evidence/20260921T1400Z-raptor/raw/prefill-131072-4096.json",
          "/home/tj/Developer/ds41rt/runs/v10-exl3-tp3/evidence/20260921T1400Z-raptor/raw/prefill-131072-8192.json",
          "/home/tj/Developer/ds41rt/runs/v10-exl3-tp3/evidence/20260921T1400Z-raptor/raw/prefill-262144-1024.json",
          "/home/tj/Developer/ds41rt/runs/v10-exl3-tp3/evidence/20260921T1400Z-raptor/raw/prefill-262144-16384.json",
          "/home/tj/Developer/ds41rt/runs/v10-exl3-tp3/evidence/20260921T1400Z-raptor/raw/prefill-262144-2048.json",
          "/home/tj/Developer/ds41rt/runs/v10-exl3-tp3/evidence/20260921T1400Z-raptor/raw/prefill-262144-32768.json",
          "/home/tj/Developer/ds41rt/runs/v10-exl3-tp3/evidence/20260921T1400Z-raptor/raw/prefill-262144-4096.json",
          "/home/tj/Developer/ds41rt/runs/v10-exl3-tp3/evidence/20260921T1400Z-raptor/raw/prefill-262144-8192.json",
          "/home/tj/Developer/ds41rt/runs/v10-exl3-tp3/evidence/20260921T1400Z-raptor/raw/prefill-32768-1024.json",
          "/home/tj/Developer/ds41rt/runs/v10-exl3-tp3/evidence/20260921T1400Z-raptor/raw/prefill-32768-16384.json",
          "/home/tj/Developer/ds41rt/runs/v10-exl3-tp3/evidence/20260921T1400Z-raptor/raw/prefill-32768-2048.json",
          "/home/tj/Developer/ds41rt/runs/v10-exl3-tp3/evidence/20260921T1400Z-raptor/raw/prefill-32768-32768.json",
          "/home/tj/Developer/ds41rt/runs/v10-exl3-tp3/evidence/20260921T1400Z-raptor/raw/prefill-32768-4096.json",
          "/home/tj/Developer/ds41rt/runs/v10-exl3-tp3/evidence/20260921T1400Z-raptor/raw/prefill-32768-8192.json",
          "/home/tj/Developer/ds41rt/runs/v10-exl3-tp3/evidence/20260921T1400Z-raptor/raw/prefill-65536-1024.json",
          "/home/tj/Developer/ds41rt/runs/v10-exl3-tp3/evidence/20260921T1400Z-raptor/raw/prefill-65536-16384.json",
          "/home/tj/Developer/ds41rt/runs/v10-exl3-tp3/evidence/20260921T1400Z-raptor/raw/prefill-65536-2048.json",
          "/home/tj/Developer/ds41rt/runs/v10-exl3-tp3/evidence/20260921T1400Z-raptor/raw/prefill-65536-32768.json",
          "/home/tj/Developer/ds41rt/runs/v10-exl3-tp3/evidence/20260921T1400Z-raptor/raw/prefill-65536-4096.json",
          "/home/tj/Developer/ds41rt/runs/v10-exl3-tp3/evidence/20260921T1400Z-raptor/raw/prefill-65536-8192.json"
        ],
        "prefill_merged_view": "/home/tj/Developer/ds41rt/runs/v10-exl3-tp3/evidence/20260921T1400Z-raptor/raw/prefill-merged.json",
        "cache_drop_evidence": "/home/tj/Developer/ds41rt/runs/v10-exl3-tp3/evidence/20260921T1400Z-raptor/cache-drop",
        "cache_drop_helper": "/usr/local/libexec/ds41rt-bench/drop-page-cache"
      },
      "raw": {
        "decode": "/home/tj/Developer/ds41rt/runs/v10-exl3-tp3/evidence/20260921T1400Z-raptor/raw/decode.json",
        "prefill": [
          "/home/tj/Developer/ds41rt/runs/v10-exl3-tp3/evidence/20260921T1400Z-raptor/raw/prefill-merged.json"
        ],
        "retained": "/home/tj/Developer/ds41rt/runs/v10-exl3-tp3/evidence/20260921T1400Z-raptor/raw/retained.json",
        "retained_control_2k": "/home/tj/Developer/ds41rt/runs/v10-exl3-tp3/evidence/20260921T1400Z-raptor/raw/retained-control-2k.json",
        "concurrency_counting": "/home/tj/Developer/ds41rt/runs/v10-exl3-tp3/evidence/20260921T1400Z-raptor/raw/concurrency-counting.json",
        "concurrency_code": "/home/tj/Developer/ds41rt/runs/v10-exl3-tp3/evidence/20260921T1400Z-raptor/raw/concurrency-code.json",
        "concurrency_topic": "/home/tj/Developer/ds41rt/runs/v10-exl3-tp3/evidence/20260921T1400Z-raptor/raw/concurrency-topic.json",
        "mixed": "/home/tj/Developer/ds41rt/runs/v10-exl3-tp3/evidence/20260921T1400Z-raptor/raw/mixed.json",
        "target_only": "/home/tj/Developer/ds41rt/runs/v10-exl3-tp3/evidence/20260921T1400Z-raptor/raw/target-only.json"
      },
      "tool_eval": {
        "summaries": "/home/tj/Developer/ds41rt/runs/v10-exl3-tp3/evidence/20260921T1400Z-raptor/tool-eval/exl3-k34-1x32g-3spark/summaries.json",
        "dir": "/home/tj/Developer/ds41rt/runs/v10-exl3-tp3/evidence/20260921T1400Z-raptor/tool-eval/exl3-k34-1x32g-3spark",
        "runs": [
          "run-01",
          "run-02",
          "run-03"
        ]
      },
      "warmup": "one shape warmup per prefill cell and the harness warmups in decode/retained",
      "repeats": 3,
      "notes": "compact EXL3 TP3: SPARK_COUNT=3 with no SPARK_TP/SPARK_EP keys; non-paired disjoint packages; production tile planner retained",
      "failures": []
    }
  ]
}
